{"mutation":{"operator_id":"sequence.insert.v1","parameters":{"campaign_seed":20260831,"operation_index":3,"template_index":0}},"operations":[{"input":"","ioctl":"RESET_STATE"},{"fields":{"mode":8},"ioctl":"SET_MODE"},{"fields":{"mode":8},"ioctl":"SET_MODE"},{"input":"","ioctl":"RESET_STATE"},{"fields":{"mode":0},"ioctl":"SET_MODE"},{"fields":{"declared_len":4,"payload":"AAAA"},"ioctl":"SUBMIT_RECORD"}],"parent_case_id":"fa5a4898d856fa7a597a04b16d970241f1c43fb00e09d199888bea62c4a9d0cb","schedule":{"delays_us":[0,0,0,0,0,0],"workers":1},"schema_version":1,"seed":1001,"target":"kcl.state"}