{"mutation":{"operator_id":"scalar.boundary.v1","parameters":{"campaign_seed":20260831,"field":"mode","from":0,"operation_index":2,"to":64}},"operations":[{"input":"","ioctl":"RESET_STATE"},{"fields":{"declared_len":4,"payload":"AAAA"},"ioctl":"SUBMIT_RECORD"},{"fields":{"mode":64},"ioctl":"SET_MODE"}],"parent_case_id":"f0e3f878325caebf0ca9d85e3a2e5f2fb48f47577df64a2eb7518ee63cb38fea","schedule":{"delays_us":[0,0,0],"workers":1},"schema_version":1,"seed":1001,"target":"kcl.state"}