{"mutation":{"operator_id":"scalar.boundary.v1","parameters":{"campaign_seed":20260831,"field":"mode","from":-1,"operation_index":1,"to":1}},"operations":[{"input":"","ioctl":"RESET_STATE"},{"fields":{"mode":1},"ioctl":"SET_MODE"},{"ioctl":"QUERY_STATS"}],"parent_case_id":"65e2d68ff73b84c28e426405889becd5613e29f03e9dec4074f9c9cb17fa2aa2","schedule":{"delays_us":[0,0,0],"workers":1},"schema_version":1,"seed":1001,"target":"kcl.state"}