{"mutation":{"operator_id":"sequence.insert.v1","parameters":{"campaign_seed":20260831,"operation_index":3,"template_index":3}},"operations":[{"input":"","ioctl":"RESET_STATE"},{"fields":{"mode":0},"ioctl":"SET_MODE"},{"fields":{"declared_len":4,"payload":"AAAA"},"ioctl":"SUBMIT_RECORD"},{"ioctl":"QUERY_STATS"}],"parent_case_id":"18e1be2d985316a623355afa5a9a8854d8b9361ec07eb878a51aeac302a0148a","schedule":{"delays_us":[0,0,0,0],"workers":1},"schema_version":1,"seed":1001,"target":"kcl.state"}