{"mutation":{"operator_id":"scalar.boundary.v1","parameters":{"campaign_seed":20260831,"field":"mode","from":0,"operation_index":1,"to":255}},"operations":[{"input":"","ioctl":"RESET_STATE"},{"fields":{"mode":255},"ioctl":"SET_MODE"},{"fields":{"declared_len":4,"payload":"AAAA"},"ioctl":"SUBMIT_RECORD"}],"parent_case_id":"18e1be2d985316a623355afa5a9a8854d8b9361ec07eb878a51aeac302a0148a","schedule":{"delays_us":[0,0,0],"workers":1},"schema_version":1,"seed":1001,"target":"kcl.state"}