{"mutation":{"operator_id":"sequence.delete.v1","parameters":{"campaign_seed":20260831,"operation_index":2}},"operations":[{"ioctl":"QUERY_STATS"},{"input":"","ioctl":"RESET_STATE"},{"fields":{"mode":2},"ioctl":"SET_MODE"},{"fields":{"declared_len":0,"payload":"A"},"ioctl":"SUBMIT_RECORD"},{"fields":{"declared_len":8,"payload":"A"},"ioctl":"SUBMIT_RECORD"},{"ioctl":"QUERY_STATS"},{"input":"","ioctl":"RESET_STATE"}],"parent_case_id":"776094e3ec061a717a8541abeed955bd42adcd8c03bdcc6c0dd7d41f26893993","schedule":{"delays_us":[0,0,0,0,0,0,0],"workers":1},"schema_version":1,"seed":1001,"target":"kcl.state"}