{"mutation":{"operator_id":"scalar.boundary.v1","parameters":{"campaign_seed":20260831,"field":"declared_len","from":4,"operation_index":2,"to":2147483647}},"operations":[{"input":"","ioctl":"RESET_STATE"},{"fields":{"mode":2},"ioctl":"SET_MODE"},{"fields":{"declared_len":2147483647,"payload":"AAAA"},"ioctl":"SUBMIT_RECORD"}],"parent_case_id":"7cd025034ab7ffff1aed0d97c50d7675f3dbcdc409caa42fcee591bcb9f10d21","schedule":{"delays_us":[0,0,0],"workers":1},"schema_version":1,"seed":1001,"target":"kcl.state"}