{"mutation":{"operator_id":"sequence.delete.v1","parameters":{"campaign_seed":20260831,"operation_index":1}},"operations":[{"input":"","ioctl":"RESET_STATE"},{"fields":{"mode":8},"ioctl":"SET_MODE"},{"fields":{"declared_len":4,"payload":"AAAA"},"ioctl":"SUBMIT_RECORD"}],"parent_case_id":"48af40a34770c64a85473ae75d593ad5c5a09ff44a41597461a82a661ee10541","schedule":{"delays_us":[0,0,0],"workers":1},"schema_version":1,"seed":1001,"target":"kcl.state"}