{"mutation":{"operator_id":"scalar.boundary.v1","parameters":{"campaign_seed":20260831,"field":"declared_len","from":5,"operation_index":3,"to":8}},"operations":[{"input":"","ioctl":"RESET_STATE"},{"fields":{"mode":2},"ioctl":"SET_MODE"},{"fields":{"declared_len":0,"payload":""},"ioctl":"SUBMIT_RECORD"},{"fields":{"declared_len":8,"payload":""},"ioctl":"SUBMIT_RECORD"}],"parent_case_id":"0fa5845c2e5ca6b809fa9ce5d96de213791e00ec47456fedc449d65cff995003","schedule":{"delays_us":[0,0,0,0],"workers":1},"schema_version":1,"seed":1001,"target":"kcl.state"}