{"mutation":{"operator_id":"scalar.boundary.v1","parameters":{"campaign_seed":20260831,"field":"declared_len","from":64,"operation_index":3,"to":16}},"operations":[{"input":"","ioctl":"RESET_STATE"},{"fields":{"mode":2},"ioctl":"SET_MODE"},{"ioctl":"QUERY_STATS"},{"fields":{"declared_len":16,"payload":"A"},"ioctl":"SUBMIT_RECORD"}],"parent_case_id":"c96af56890cc2acc62a704233a9b98a02c78ec579bcd44fef41a161b703fad6f","schedule":{"delays_us":[0,0,0,0],"workers":1},"schema_version":1,"seed":1001,"target":"kcl.state"}