{"mutation":{"operator_id":"scalar.boundary.v1","parameters":{"campaign_seed":20260831,"field":"mode","from":8,"operation_index":1,"to":16}},"operations":[{"input":"","ioctl":"RESET_STATE"},{"fields":{"mode":16},"ioctl":"SET_MODE"},{"fields":{"declared_len":4,"payload":"AAAA"},"ioctl":"SUBMIT_RECORD"},{"input":"","ioctl":"RESET_STATE"},{"fields":{"mode":0},"ioctl":"SET_MODE"}],"parent_case_id":"11f782df055fc26e1376cde0c955a18fd836276956c6a05f4f97f493fba5ca8d","schedule":{"delays_us":[0,0,0,0,0],"workers":1},"schema_version":1,"seed":1001,"target":"kcl.state"}