{"mutation":{"operator_id":"scalar.boundary.v1","parameters":{"campaign_seed":20260831,"field":"mode","from":-1,"operation_index":1,"to":1}},"operations":[{"input":"","ioctl":"RESET_STATE"},{"fields":{"mode":1},"ioctl":"SET_MODE"},{"fields":{"mode":0},"ioctl":"SET_MODE"},{"ioctl":"QUERY_STATS"}],"parent_case_id":"8668bced57dc90db4b5dff6380b7a8013b20be624be03ebe9405ea083b956e54","schedule":{"delays_us":[0,0,0,0],"workers":1},"schema_version":1,"seed":1001,"target":"kcl.state"}