{"mutation":{"operator_id":"sequence.insert.v1","parameters":{"campaign_seed":20260831,"operation_index":1,"template_index":3}},"operations":[{"input":"","ioctl":"RESET_STATE"},{"ioctl":"QUERY_STATS"},{"fields":{"mode":2},"ioctl":"SET_MODE"},{"fields":{"declared_len":5,"payload":""},"ioctl":"SUBMIT_RECORD"}],"parent_case_id":"0c993954d1aaa3f5a958c02e8a6ac10d059d8da11246d3987375b1ce71c7f0b6","schedule":{"delays_us":[0,0,0,0],"workers":1},"schema_version":1,"seed":1001,"target":"kcl.state"}