{"mutation":{"operator_id":"sequence.swap-adjacent.v1","parameters":{"campaign_seed":20260831,"left_index":3,"right_index":4}},"operations":[{"input":"","ioctl":"RESET_STATE"},{"input":"","ioctl":"RESET_STATE"},{"fields":{"mode":2},"ioctl":"SET_MODE"},{"fields":{"declared_len":64,"payload":"A"},"ioctl":"SUBMIT_RECORD"},{"fields":{"declared_len":255,"payload":"A"},"ioctl":"SUBMIT_RECORD"}],"parent_case_id":"5ec626d5dccd3a453d42cc7b4c7188b0e77c19ecf63b8e1bad83e19a987edbe1","schedule":{"delays_us":[0,0,0,0,0],"workers":1},"schema_version":1,"seed":1001,"target":"kcl.state"}