{"mutation":{"operator_id":"sequence.delete.v1","parameters":{"campaign_seed":20260831,"operation_index":11}},"operations":[{"input":"","ioctl":"RESET_STATE"},{"input":"","ioctl":"RESET_STATE"},{"fields":{"mode":8},"ioctl":"SET_MODE"},{"fields":{"mode":2},"ioctl":"SET_MODE"},{"fields":{"declared_len":16,"payload":""},"ioctl":"SUBMIT_RECORD"},{"ioctl":"QUERY_STATS"},{"ioctl":"QUERY_STATS"},{"ioctl":"QUERY_STATS"},{"fields":{"declared_len":0,"payload":""},"ioctl":"SUBMIT_RECORD"},{"fields":{"declared_len":0,"payload":""},"ioctl":"SUBMIT_RECORD"},{"fields":{"declared_len":8,"payload":"A"},"ioctl":"SUBMIT_RECORD"},{"fields":{"mode":0},"ioctl":"SET_MODE"}],"parent_case_id":"3b10a59d54de4fdcd8ee7bed532c8dd6fc7e47b80e1dcc90d9331eecba7e04a7","schedule":{"delays_us":[0,0,0,0,0,0,0,0,0,0,0,0],"workers":1},"schema_version":1,"seed":1001,"target":"kcl.state"}