{"mutation":{"operator_id":"sequence.swap-adjacent.v1","parameters":{"campaign_seed":20260831,"left_index":1,"right_index":2}},"operations":[{"input":"","ioctl":"RESET_STATE"},{"input":"","ioctl":"RESET_STATE"},{"fields":{"mode":2},"ioctl":"SET_MODE"},{"fields":{"mode":2},"ioctl":"SET_MODE"},{"ioctl":"QUERY_STATS"},{"fields":{"declared_len":8,"payload":"A"},"ioctl":"SUBMIT_RECORD"},{"input":"","ioctl":"RESET_STATE"}],"parent_case_id":"d38012567abe2fed5e9b306944d807608c1257b43cd425f0b37f9e2c61a2e541","schedule":{"delays_us":[0,0,0,0,0,0,0],"workers":1},"schema_version":1,"seed":1001,"target":"kcl.state"}