{"mutation":{"operator_id":"scalar.boundary.v1","parameters":{"campaign_seed":20260831,"field":"declared_len","from":4,"operation_index":4,"to":16}},"operations":[{"input":"","ioctl":"RESET_STATE"},{"input":"","ioctl":"RESET_STATE"},{"fields":{"mode":8},"ioctl":"SET_MODE"},{"fields":{"mode":2},"ioctl":"SET_MODE"},{"fields":{"declared_len":16,"payload":""},"ioctl":"SUBMIT_RECORD"},{"ioctl":"QUERY_STATS"},{"ioctl":"QUERY_STATS"},{"fields":{"declared_len":0,"payload":""},"ioctl":"SUBMIT_RECORD"},{"fields":{"declared_len":8,"payload":"A"},"ioctl":"SUBMIT_RECORD"},{"input":"","ioctl":"RESET_STATE"}],"parent_case_id":"5a0dc13f5ec6d2271e18ecdefe9a0b8205ac50d646422570f77ab3c8e0418052","schedule":{"delays_us":[0,0,0,0,0,0,0,0,0,0],"workers":1},"schema_version":1,"seed":1001,"target":"kcl.state"}