{"mutation":{"operator_id":"scalar.boundary.v1","parameters":{"campaign_seed":20260831,"field":"declared_len","from":5,"operation_index":4,"to":16}},"operations":[{"input":"","ioctl":"RESET_STATE"},{"fields":{"mode":2},"ioctl":"SET_MODE"},{"fields":{"declared_len":0,"payload":""},"ioctl":"SUBMIT_RECORD"},{"ioctl":"QUERY_STATS"},{"fields":{"declared_len":16,"payload":""},"ioctl":"SUBMIT_RECORD"}],"parent_case_id":"02fddd4b90aebe6d6a9def4ecd1e42400ee99dd1d99b989712b9835b5618f487","schedule":{"delays_us":[0,0,0,0,0],"workers":1},"schema_version":1,"seed":1001,"target":"kcl.state"}