{"mutation":{"operator_id":"sequence.delete.v1","parameters":{"campaign_seed":20260831,"operation_index":3}},"operations":[{"input":"","ioctl":"RESET_STATE"},{"input":"","ioctl":"RESET_STATE"},{"fields":{"mode":2},"ioctl":"SET_MODE"},{"fields":{"declared_len":8,"payload":"A"},"ioctl":"SUBMIT_RECORD"}],"parent_case_id":"fe728b71ce228f7f7e337bca3f7cc80e2dcc4af4a544148625d2110738abb930","schedule":{"delays_us":[0,0,0,0],"workers":1},"schema_version":1,"seed":1001,"target":"kcl.state"}