{"mutation":{"operator_id":"sequence.insert.v1","parameters":{"campaign_seed":20260831,"operation_index":0,"template_index":3}},"operations":[{"ioctl":"QUERY_STATS"},{"input":"","ioctl":"RESET_STATE"},{"fields":{"mode":0},"ioctl":"SET_MODE"},{"fields":{"declared_len":4,"payload":"AAAA"},"ioctl":"SUBMIT_RECORD"},{"fields":{"mode":0},"ioctl":"SET_MODE"}],"parent_case_id":"090637d0f9477576c09a4672b85b67b8ca412640c1790ec26f7b27209e0cfbeb","schedule":{"delays_us":[0,0,0,0,0],"workers":1},"schema_version":1,"seed":1001,"target":"kcl.state"}