{"mutation":{"operator_id":"sequence.insert.v1","parameters":{"campaign_seed":20260831,"operation_index":3,"template_index":1}},"operations":[{"input":"","ioctl":"RESET_STATE"},{"fields":{"mode":7},"ioctl":"SET_MODE"},{"fields":{"declared_len":4,"payload":"AAAA"},"ioctl":"SUBMIT_RECORD"},{"fields":{"mode":0},"ioctl":"SET_MODE"}],"parent_case_id":"1b22c07b45f9950c64ae9f2c1b4b24e4d04d0cbaa639a79d038c6f82c2f34fb6","schedule":{"delays_us":[0,0,0,0],"workers":1},"schema_version":1,"seed":1001,"target":"kcl.state"}